{
  "schema_version": 1,
  "episode_id": "EP-20260916-001",
  "source_type": "acceptance",
  "objective": "吸收 aiwork-workflow-ai 的设计模板与 issue 记录优点，建立双仓评审桥",
  "outcome": "accepted",
  "signals": [
    { "kind": "user_visible_claims", "value": 3, "evidence_ref": "会话最终决策记录：三纪律四处落点、评审桥落盘、负向实验全过" },
    { "kind": "review_decision", "value": "approved", "evidence_ref": "自审修复四缺陷后 validate.py all 七项 PASS" },
    { "kind": "cost", "value": "1 session", "evidence_ref": "not measured (host did not report)" }
  ],
  "feedback_summary": "用户逐条指示推进（P 级、provenance、引用自包含、feature 锚目录）；两次中途修正（评审目录锚点、片段强制）均当场吸收；自审抓出四个规则缺陷。",
  "agentflow_version": "0.4.0",
  "host": "other",
  "provenance": {
    "carrier": "zcode-session",
    "sanitized": true
  },
  "redactions": ["业务仓内部路径细节"],
  "occurred_at": "2026-09-16T12:00:00Z"
}
