{
  "schema_version": 1,
  "episode_id": "EP-20260917-003",
  "source_type": "user_feedback",
  "objective": "补齐自动化测试能力：用户要求 Agentflow 能对用户可见功能做真实浏览器自动化测试——提前提供账号密码，按实现的功能执行逻辑操作（登录输账号密码、注册输邮箱、故意输错邮箱格式看前端校验、空密码看拦截提示），用例要细化到边界与逐步操作，产出测试文档与执行报告；执行发现的失败与覆盖缺口立案为 bug 记录；并对流程本身做合理性判断（e2e、冒烟等专业分级）",
  "outcome": "accepted",
  "signals": [
    {
      "kind": "capability_gap",
      "value": "no test-design/test-execution roles existed before 0.7.0",
      "evidence_ref": "0.6.0 角色清单（agents/ 目录）只有实现、评审、bug、规划与 improve 角色；reviewer 仅含 Test depth 专项模式，无用例设计与执行能力"
    },
    {
      "kind": "design_decision",
      "value": "two new roles + three augmentations + one new record class",
      "evidence_ref": "新增 agents/test-planner.md 与 agents/test-executor.md；plan-architect 增加测试设计任务条款、reviewer 增加 Flow reasonableness (test evidence) 专项模式、agentflow SKILL 新增 Automated testing 段；记录类 records/tests/（plan-*/run-* + schema + validate 接线）"
    },
    {
      "kind": "constraint",
      "value": "host browser automation is main-conversation-only",
      "evidence_ref": "ZCode/Claude Code 的 browser-use/computer-use 为 main-agent-only，子代理不能加载；UI 步骤分工定为：executor 编译步骤脚本+断言清单，supervisor 主对话执行并回传原始证据，executor 只依原始证据判定；脚本化 Playwright 为首选路线"
    },
    {
      "kind": "credentials_discipline",
      "value": "injection method declared, values never persisted",
      "evidence_ref": "plan/run frontmatter 的 credentials 字段只写注入方式；角色定义与 records/tests/README.md 明令禁止密码/token 落盘，trace/截图捕获敏感值须声明"
    },
    {
      "kind": "gate_change",
      "value": "human-directed",
      "evidence_ref": "schemas/test-plan.schema.json、schemas/test-run.schema.json（schemas/ 为保护前缀）、tools/lab/validate.py、tests/test_lab_contracts.py 为受保护门文件；用户在会话中明确批准方案（含 records/tests/ + schema + validate 接线三项拍板点）后落地，沿 0.6.0 \"gate change, human-directed\" 先例"
    },
    {
      "kind": "measurement",
      "value": "none (method-level change, no instrumented business task)",
      "evidence_ref": "方法级改动，evals/ 无登录流测量切片；后续可为测试能力本身种缺陷快照建业务切片"
    }
  ],
  "feedback_summary": "用户在 0.6.0 基线上提出自动化测试能力诉求（浏览器 MCP/Playwright、账号注入、边界用例、执行报告、bug 回流、流程合理性判断、e2e/冒烟分级）。方案经两轮对话确认后一次性落地 0.7.0：test-planner/test-executor 两个角色 + plan-architect/reviewer/SKILL 三处增补 + records/tests/ 记录类（TP/TR id、TC 注册表、固定结果枚举、summary 计数对账、findings 指向现存 bug 记录、凭据纪律）。机器可查契约：用例数对账、结果枚举、失败/阻塞行必须带证据、钉当前版本时全用例对账、计划同目录解析。遗留：宿主浏览器路线的可重复性依赖被测项目配 Playwright；测试能力本身的回归测量需后续业务切片。",
  "agentflow_version": "0.6.0",
  "host": "other",
  "provenance": {
    "carrier": "zcode-session",
    "sanitized": true
  },
  "redactions": [
    "用户举例中的账号/密码类表述（仅有形式示例，未提供真实凭据）"
  ],
  "occurred_at": "2026-09-17T16:30:00Z"
}
