{
  "schema_version": 1,
  "episode_id": "EP-20260917-901",
  "source_type": "review",
  "objective": "【样板】演示 episode 落盘形态——一次任务的决策记录持久化",
  "outcome": "partial",
  "signals": [
    { "kind": "review_decision", "value": "changes_requested", "evidence_ref": "REV-20260917-001" },
    { "kind": "user_visible_claims", "value": 2, "evidence_ref": "评审结论两条，均未闭合" },
    { "kind": "cost", "value": "not reported", "evidence_ref": "host 未上报，不估算" }
  ],
  "feedback_summary": "演示内容：评审提出两条缺口（时序缺失、异常矩阵缺行），一条已转 bug 记录；任务以 partial 收口。",
  "agentflow_version": "0.4.2",
  "host": "other",
  "provenance": { "carrier": "zcode-session", "sanitized": true },
  "redactions": [],
  "occurred_at": "2026-09-17T03:00:00Z"
}
